{
  "id": "bootstrap-mapping.semantic-contract.tenant-data-import-export",
  "title": "Bootstrap Mapping for Tenant Data Import Export Semantic Contract",
  "description": "Canonical governance mapping from a semantic contract to future implementation target, provider/adapter target, expected tests, proof gates, deferrals, and blockers. It creates no runtime or scaffold files.",
  "authorityLevel": "semantic-definition",
  "lifecycleState": "draft",
  "ontologyConcepts": [
    "Semantic Contract",
    "Source Reference",
    "Disposition",
    "Provider",
    "Environment",
    "Proof"
  ],
  "taxonomyRefs": [
    "semantic-architecture-classification",
    "source-role-classification"
  ],
  "vocabularyRefs": [
    "authority-levels",
    "lifecycle-states",
    "provider-modes",
    "environment-classes",
    "proof-levels",
    "disposition-values"
  ],
  "aiGuidance": "Use this mapping as bootstrap planning authority only. Do not create implementation paths, claim production readiness, or start USF-39 from this record.",
  "semanticContractRef": "semantic-contract.tenant-data-import-export",
  "mappingStatus": "mapped-with-pre-file-blocker",
  "capabilityDomain": "data-platform",
  "sourceRefs": [
    "docs/architecture/capability-source-coverage-matrix.md",
    "docs/architecture/foundation-completeness-audit.md"
  ],
  "capabilityTargets": [
    {
      "target": "capabilities/tenant",
      "role": "future capability or shared package target",
      "status": "planned-not-created",
      "rationale": "Future target path recorded as governance-only topology intent; the path is not created by this mapping."
    },
    {
      "target": "packages/source",
      "role": "future capability or shared package target",
      "status": "planned-not-created",
      "rationale": "Future target path recorded as governance-only topology intent; the path is not created by this mapping."
    },
    {
      "target": "packages/proof",
      "role": "future capability or shared package target",
      "status": "planned-not-created",
      "rationale": "Future target path recorded as governance-only topology intent; the path is not created by this mapping."
    }
  ],
  "adapterProviderTargets": [
    {
      "target": "adapters/db",
      "role": "future adapter or provider target",
      "status": "planned-not-created",
      "rationale": "Future target path recorded as governance-only topology intent; the path is not created by this mapping."
    }
  ],
  "expectedTests": [
    {
      "scope": "local-dev",
      "target": "packages/test",
      "expectation": "Future local dev tests use in-memory providers and deterministic synthetic fixtures; no in-memory provider satisfies test-compose proof."
    },
    {
      "scope": "compose-test",
      "target": "tests/{apps,capabilities,adapters,packages}",
      "expectation": "Future test proof uses local Docker Compose OSS providers and deterministic synthetic data; no staging, production, or live provider claim is made."
    }
  ],
  "expectedProofGates": [
    {
      "environment": "local",
      "providerMode": "hermetic-mock",
      "proofLevel": "behaviour-proven",
      "status": "required-before-implementation-claim",
      "expectation": "Local dev proof may use in-memory or hermetic providers and must remain explicitly local/hermetic."
    },
    {
      "environment": "integration",
      "providerMode": "local-composed-real-service",
      "proofLevel": "substrate-proven",
      "status": "required-before-test-readiness-claim",
      "expectation": "Test readiness requires local composed OSS providers for provider-backed claims."
    },
    {
      "environment": "staging",
      "providerMode": "live-external-provider",
      "proofLevel": "not-claimed",
      "status": "deferred-not-bootstrap-readiness",
      "expectation": "Staging and live-external-provider proof remain outside this bootstrap scope and must not be inferred from local/test proof."
    },
    {
      "environment": "production-live",
      "providerMode": "live-external-provider",
      "proofLevel": "not-claimed",
      "status": "deferred-not-bootstrap-readiness",
      "expectation": "Production-live proof is not claimed by bootstrap mappings."
    }
  ],
  "deferrals": [
    {
      "scope": "staging-production-live-proof",
      "reason": "Staging, production, live-external-provider, production-live, and deployment proof are deferred from the first bootstrap readiness scope.",
      "issueRef": "USF-73/USF-99"
    },
    {
      "scope": "implementation-start",
      "reason": "Implementation extraction remains blocked until USF-100 is signed and a separate USF-39 start action is authorised.",
      "issueRef": "USF-100/USF-39"
    }
  ],
  "blockers": [
    {
      "scope": "pre-file-implementation-gate",
      "reason": "Exact target files, per-slice topology, and per-slice source-use disposition must be reviewed before any implementation file is created.",
      "blockingUntil": "Signed USF-100 plus per-slice topology/source-use gate and clean validators.",
      "issueRef": "USF-97/USF-98/USF-117"
    }
  ],
  "persistentObjectExpectations": [
    {
      "object": "relational data, migration, retention, import, and export records",
      "classification": "migration/control-plane",
      "expectation": "Future persistence must classify this object before migrations or storage implementation are created; unclassified persistent objects fail bootstrap validation."
    }
  ]
}
